<?xml version="1.0" encoding="UTF-8"?>
<dataroot xmlns:od="urn:schemas-microsoft-com:officedata" xmlns:xsi="http://www.w3.org/2001/XMLSchema-instance"  xsi:noNamespaceSchemaLocation="03p_ActivityPersonRoles.xsd" generated="2025-09-22T19:00:55">
<_x0030_3p_ActivityPersonRoles>
<ID>6</ID>
<ActivityID>19</ActivityID>
<PersonID>24</PersonID>
<RoleID>3</RoleID>
</_x0030_3p_ActivityPersonRoles>
<_x0030_3p_ActivityPersonRoles>
<ID>7</ID>
<ActivityID>19</ActivityID>
<PersonID>25</PersonID>
<RoleID>3</RoleID>
</_x0030_3p_ActivityPersonRoles>
<_x0030_3p_ActivityPersonRoles>
<ID>8</ID>
<ActivityID>53</ActivityID>
<PersonID>70</PersonID>
<RoleID>1</RoleID>
</_x0030_3p_ActivityPersonRoles>
<_x0030_3p_ActivityPersonRoles>
<ID>9</ID>
<ActivityID>22</ActivityID>
<PersonID>15</PersonID>
<RoleID>3</RoleID>
</_x0030_3p_ActivityPersonRoles>
<_x0030_3p_ActivityPersonRoles>
<ID>10</ID>
<ActivityID>22</ActivityID>
<PersonID>15</PersonID>
<RoleID>1</RoleID>
</_x0030_3p_ActivityPersonRoles>
<_x0030_3p_ActivityPersonRoles>
<ID>11</ID>
<ActivityID>18</ActivityID>
<PersonID>23</PersonID>
<RoleID>1</RoleID>
</_x0030_3p_ActivityPersonRoles>
<_x0030_3p_ActivityPersonRoles>
<ID>12</ID>
<ActivityID>18</ActivityID>
<PersonID>22</PersonID>
<RoleID>1</RoleID>
</_x0030_3p_ActivityPersonRoles>
<_x0030_3p_ActivityPersonRoles>
<ID>13</ID>
<ActivityID>27</ActivityID>
<PersonID>18</PersonID>
<RoleID>1</RoleID>
</_x0030_3p_ActivityPersonRoles>
<_x0030_3p_ActivityPersonRoles>
<ID>14</ID>
<ActivityID>27</ActivityID>
<PersonID>18</PersonID>
<RoleID>3</RoleID>
</_x0030_3p_ActivityPersonRoles>
<_x0030_3p_ActivityPersonRoles>
<ID>15</ID>
<ActivityID>27</ActivityID>
<PersonID>18</PersonID>
<RoleID>2</RoleID>
</_x0030_3p_ActivityPersonRoles>
<_x0030_3p_ActivityPersonRoles>
<ID>16</ID>
<ActivityID>27</ActivityID>
<PersonID>17</PersonID>
<RoleID>3</RoleID>
</_x0030_3p_ActivityPersonRoles>
<_x0030_3p_ActivityPersonRoles>
<ID>17</ID>
<ActivityID>27</ActivityID>
<PersonID>17</PersonID>
<RoleID>1</RoleID>
</_x0030_3p_ActivityPersonRoles>
<_x0030_3p_ActivityPersonRoles>
<ID>18</ID>
<ActivityID>27</ActivityID>
<PersonID>17</PersonID>
<RoleID>2</RoleID>
</_x0030_3p_ActivityPersonRoles>
<_x0030_3p_ActivityPersonRoles>
<ID>19</ID>
<ActivityID>4</ActivityID>
<PersonID>18</PersonID>
<RoleID>3</RoleID>
</_x0030_3p_ActivityPersonRoles>
<_x0030_3p_ActivityPersonRoles>
<ID>20</ID>
<ActivityID>4</ActivityID>
<PersonID>18</PersonID>
<RoleID>1</RoleID>
</_x0030_3p_ActivityPersonRoles>
<_x0030_3p_ActivityPersonRoles>
<ID>21</ID>
<ActivityID>4</ActivityID>
<PersonID>18</PersonID>
<RoleID>2</RoleID>
</_x0030_3p_ActivityPersonRoles>
<_x0030_3p_ActivityPersonRoles>
<ID>22</ID>
<ActivityID>4</ActivityID>
<PersonID>17</PersonID>
<RoleID>3</RoleID>
</_x0030_3p_ActivityPersonRoles>
<_x0030_3p_ActivityPersonRoles>
<ID>23</ID>
<ActivityID>4</ActivityID>
<PersonID>17</PersonID>
<RoleID>1</RoleID>
</_x0030_3p_ActivityPersonRoles>
<_x0030_3p_ActivityPersonRoles>
<ID>24</ID>
<ActivityID>4</ActivityID>
<PersonID>17</PersonID>
<RoleID>2</RoleID>
</_x0030_3p_ActivityPersonRoles>
<_x0030_3p_ActivityPersonRoles>
<ID>25</ID>
<ActivityID>21</ActivityID>
<PersonID>41</PersonID>
<RoleID>3</RoleID>
</_x0030_3p_ActivityPersonRoles>
<_x0030_3p_ActivityPersonRoles>
<ID>26</ID>
<ActivityID>21</ActivityID>
<PersonID>41</PersonID>
<RoleID>1</RoleID>
</_x0030_3p_ActivityPersonRoles>
<_x0030_3p_ActivityPersonRoles>
<ID>27</ID>
<ActivityID>21</ActivityID>
<PersonID>40</PersonID>
<RoleID>3</RoleID>
</_x0030_3p_ActivityPersonRoles>
<_x0030_3p_ActivityPersonRoles>
<ID>28</ID>
<ActivityID>21</ActivityID>
<PersonID>40</PersonID>
<RoleID>1</RoleID>
</_x0030_3p_ActivityPersonRoles>
<_x0030_3p_ActivityPersonRoles>
<ID>29</ID>
<ActivityID>31</ActivityID>
<PersonID>44</PersonID>
<RoleID>3</RoleID>
</_x0030_3p_ActivityPersonRoles>
<_x0030_3p_ActivityPersonRoles>
<ID>30</ID>
<ActivityID>33</ActivityID>
<PersonID>49</PersonID>
<RoleID>3</RoleID>
</_x0030_3p_ActivityPersonRoles>
<_x0030_3p_ActivityPersonRoles>
<ID>31</ID>
<ActivityID>33</ActivityID>
<PersonID>49</PersonID>
<RoleID>1</RoleID>
</_x0030_3p_ActivityPersonRoles>
<_x0030_3p_ActivityPersonRoles>
<ID>32</ID>
<ActivityID>33</ActivityID>
<PersonID>49</PersonID>
<RoleID>1</RoleID>
</_x0030_3p_ActivityPersonRoles>
<_x0030_3p_ActivityPersonRoles>
<ID>33</ID>
<ActivityID>34</ActivityID>
<PersonID>49</PersonID>
<RoleID>3</RoleID>
</_x0030_3p_ActivityPersonRoles>
<_x0030_3p_ActivityPersonRoles>
<ID>34</ID>
<ActivityID>34</ActivityID>
<PersonID>49</PersonID>
<RoleID>1</RoleID>
</_x0030_3p_ActivityPersonRoles>
<_x0030_3p_ActivityPersonRoles>
<ID>35</ID>
<ActivityID>34</ActivityID>
<PersonID>49</PersonID>
<RoleID>2</RoleID>
</_x0030_3p_ActivityPersonRoles>
<_x0030_3p_ActivityPersonRoles>
<ID>36</ID>
<ActivityID>32</ActivityID>
<PersonID>21</PersonID>
<RoleID>3</RoleID>
</_x0030_3p_ActivityPersonRoles>
<_x0030_3p_ActivityPersonRoles>
<ID>37</ID>
<ActivityID>32</ActivityID>
<PersonID>21</PersonID>
<RoleID>1</RoleID>
</_x0030_3p_ActivityPersonRoles>
<_x0030_3p_ActivityPersonRoles>
<ID>38</ID>
<ActivityID>32</ActivityID>
<PersonID>21</PersonID>
<RoleID>2</RoleID>
</_x0030_3p_ActivityPersonRoles>
<_x0030_3p_ActivityPersonRoles>
<ID>39</ID>
<ActivityID>32</ActivityID>
<PersonID>51</PersonID>
<RoleID>1</RoleID>
</_x0030_3p_ActivityPersonRoles>
<_x0030_3p_ActivityPersonRoles>
<ID>40</ID>
<ActivityID>32</ActivityID>
<PersonID>52</PersonID>
<RoleID>3</RoleID>
</_x0030_3p_ActivityPersonRoles>
<_x0030_3p_ActivityPersonRoles>
<ID>41</ID>
<ActivityID>32</ActivityID>
<PersonID>52</PersonID>
<RoleID>1</RoleID>
</_x0030_3p_ActivityPersonRoles>
<_x0030_3p_ActivityPersonRoles>
<ID>42</ID>
<ActivityID>32</ActivityID>
<PersonID>52</PersonID>
<RoleID>2</RoleID>
</_x0030_3p_ActivityPersonRoles>
<_x0030_3p_ActivityPersonRoles>
<ID>43</ID>
<ActivityID>16</ActivityID>
<PersonID>21</PersonID>
<RoleID>3</RoleID>
</_x0030_3p_ActivityPersonRoles>
<_x0030_3p_ActivityPersonRoles>
<ID>44</ID>
<ActivityID>16</ActivityID>
<PersonID>21</PersonID>
<RoleID>1</RoleID>
</_x0030_3p_ActivityPersonRoles>
<_x0030_3p_ActivityPersonRoles>
<ID>45</ID>
<ActivityID>16</ActivityID>
<PersonID>21</PersonID>
<RoleID>2</RoleID>
</_x0030_3p_ActivityPersonRoles>
<_x0030_3p_ActivityPersonRoles>
<ID>46</ID>
<ActivityID>16</ActivityID>
<PersonID>51</PersonID>
<RoleID>1</RoleID>
</_x0030_3p_ActivityPersonRoles>
<_x0030_3p_ActivityPersonRoles>
<ID>47</ID>
<ActivityID>16</ActivityID>
<PersonID>52</PersonID>
<RoleID>3</RoleID>
</_x0030_3p_ActivityPersonRoles>
<_x0030_3p_ActivityPersonRoles>
<ID>48</ID>
<ActivityID>16</ActivityID>
<PersonID>52</PersonID>
<RoleID>1</RoleID>
</_x0030_3p_ActivityPersonRoles>
<_x0030_3p_ActivityPersonRoles>
<ID>49</ID>
<ActivityID>16</ActivityID>
<PersonID>52</PersonID>
<RoleID>2</RoleID>
</_x0030_3p_ActivityPersonRoles>
<_x0030_3p_ActivityPersonRoles>
<ID>50</ID>
<ActivityID>35</ActivityID>
<PersonID>53</PersonID>
<RoleID>1</RoleID>
</_x0030_3p_ActivityPersonRoles>
<_x0030_3p_ActivityPersonRoles>
<ID>51</ID>
<ActivityID>35</ActivityID>
<PersonID>54</PersonID>
<RoleID>1</RoleID>
</_x0030_3p_ActivityPersonRoles>
<_x0030_3p_ActivityPersonRoles>
<ID>52</ID>
<ActivityID>36</ActivityID>
<PersonID>55</PersonID>
<RoleID>1</RoleID>
</_x0030_3p_ActivityPersonRoles>
<_x0030_3p_ActivityPersonRoles>
<ID>53</ID>
<ActivityID>37</ActivityID>
<PersonID>55</PersonID>
<RoleID>1</RoleID>
</_x0030_3p_ActivityPersonRoles>
<_x0030_3p_ActivityPersonRoles>
<ID>54</ID>
<ActivityID>38</ActivityID>
<PersonID>56</PersonID>
<RoleID>3</RoleID>
</_x0030_3p_ActivityPersonRoles>
<_x0030_3p_ActivityPersonRoles>
<ID>55</ID>
<ActivityID>38</ActivityID>
<PersonID>56</PersonID>
<RoleID>1</RoleID>
</_x0030_3p_ActivityPersonRoles>
<_x0030_3p_ActivityPersonRoles>
<ID>56</ID>
<ActivityID>38</ActivityID>
<PersonID>56</PersonID>
<RoleID>2</RoleID>
</_x0030_3p_ActivityPersonRoles>
<_x0030_3p_ActivityPersonRoles>
<ID>57</ID>
<ActivityID>38</ActivityID>
<PersonID>57</PersonID>
<RoleID>3</RoleID>
</_x0030_3p_ActivityPersonRoles>
<_x0030_3p_ActivityPersonRoles>
<ID>58</ID>
<ActivityID>38</ActivityID>
<PersonID>57</PersonID>
<RoleID>1</RoleID>
</_x0030_3p_ActivityPersonRoles>
<_x0030_3p_ActivityPersonRoles>
<ID>59</ID>
<ActivityID>38</ActivityID>
<PersonID>57</PersonID>
<RoleID>2</RoleID>
</_x0030_3p_ActivityPersonRoles>
<_x0030_3p_ActivityPersonRoles>
<ID>60</ID>
<ActivityID>38</ActivityID>
<PersonID>58</PersonID>
<RoleID>3</RoleID>
</_x0030_3p_ActivityPersonRoles>
<_x0030_3p_ActivityPersonRoles>
<ID>61</ID>
<ActivityID>38</ActivityID>
<PersonID>58</PersonID>
<RoleID>1</RoleID>
</_x0030_3p_ActivityPersonRoles>
<_x0030_3p_ActivityPersonRoles>
<ID>62</ID>
<ActivityID>38</ActivityID>
<PersonID>58</PersonID>
<RoleID>2</RoleID>
</_x0030_3p_ActivityPersonRoles>
<_x0030_3p_ActivityPersonRoles>
<ID>63</ID>
<ActivityID>38</ActivityID>
<PersonID>59</PersonID>
<RoleID>3</RoleID>
</_x0030_3p_ActivityPersonRoles>
<_x0030_3p_ActivityPersonRoles>
<ID>64</ID>
<ActivityID>38</ActivityID>
<PersonID>59</PersonID>
<RoleID>1</RoleID>
</_x0030_3p_ActivityPersonRoles>
<_x0030_3p_ActivityPersonRoles>
<ID>65</ID>
<ActivityID>38</ActivityID>
<PersonID>59</PersonID>
<RoleID>2</RoleID>
</_x0030_3p_ActivityPersonRoles>
<_x0030_3p_ActivityPersonRoles>
<ID>66</ID>
<ActivityID>41</ActivityID>
<PersonID>60</PersonID>
<RoleID>1</RoleID>
</_x0030_3p_ActivityPersonRoles>
<_x0030_3p_ActivityPersonRoles>
<ID>67</ID>
<ActivityID>41</ActivityID>
<PersonID>61</PersonID>
<RoleID>1</RoleID>
</_x0030_3p_ActivityPersonRoles>
<_x0030_3p_ActivityPersonRoles>
<ID>68</ID>
<ActivityID>40</ActivityID>
<PersonID>60</PersonID>
<RoleID>1</RoleID>
</_x0030_3p_ActivityPersonRoles>
<_x0030_3p_ActivityPersonRoles>
<ID>69</ID>